{
  "phase": {
    "id": "reveal",
    "startedAt": 11000,
    "deadline": null
  },
  "phaseClock": 11000,
  "rng": {
    "seed": 61822,
    "step": 16
  },
  "players": {
    "p0": {
      "id": "p0",
      "name": "Player 1",
      "avatarId": "face-0",
      "connected": true,
      "bot": true,
      "canSeeTv": true
    },
    "p1": {
      "id": "p1",
      "name": "Player 2",
      "avatarId": "face-1",
      "connected": true,
      "bot": true,
      "canSeeTv": true
    },
    "p2": {
      "id": "p2",
      "name": "Player 3",
      "avatarId": "face-2",
      "connected": true,
      "bot": true,
      "canSeeTv": true
    }
  },
  "order": [
    "p0",
    "p1",
    "p2"
  ],
  "settings": {
    "onesWild": true,
    "palificoEnabled": true,
    "palificoExemption": "none",
    "calzaEnabled": false,
    "calzaPolicy": "anyOther",
    "turnSeconds": 0
  },
  "cups": {
    "p0": [
      6,
      5,
      1,
      5,
      2
    ],
    "p1": [
      1,
      4,
      1,
      6,
      2
    ],
    "p2": [
      1,
      1,
      4,
      1,
      4
    ]
  },
  "diceCount": {
    "p0": 5,
    "p1": 4,
    "p2": 5
  },
  "turn": "p1",
  "round": 1,
  "bid": {
    "quantity": 7,
    "face": 5,
    "playerId": "p0"
  },
  "bidLog": [
    {
      "quantity": 1,
      "face": 2,
      "playerId": "p1"
    },
    {
      "quantity": 1,
      "face": 4,
      "playerId": "p2"
    },
    {
      "quantity": 1,
      "face": 5,
      "playerId": "p0"
    },
    {
      "quantity": 1,
      "face": 6,
      "playerId": "p1"
    },
    {
      "quantity": 1,
      "face": 1,
      "playerId": "p2"
    },
    {
      "quantity": 3,
      "face": 5,
      "playerId": "p0"
    },
    {
      "quantity": 2,
      "face": 1,
      "playerId": "p1"
    },
    {
      "quantity": 3,
      "face": 1,
      "playerId": "p2"
    },
    {
      "quantity": 7,
      "face": 5,
      "playerId": "p0"
    }
  ],
  "palifico": false,
  "palificoStarter": null,
  "seenPalifico": {
    "p0": false,
    "p1": false,
    "p2": false
  },
  "nextStarter": "p1",
  "nextPalifico": null,
  "reveal": {
    "kind": "dudo",
    "caller": "p1",
    "bid": {
      "quantity": 7,
      "face": 5,
      "playerId": "p0"
    },
    "matches": 8,
    "correct": false,
    "loser": "p1",
    "gained": false,
    "dice": {
      "p0": [
        6,
        5,
        1,
        5,
        2
      ],
      "p1": [
        1,
        4,
        1,
        6,
        2
      ],
      "p2": [
        1,
        1,
        4,
        1,
        4
      ]
    }
  },
  "eliminated": [],
  "left": [],
  "models": {
    "p0": {
      "truth": 6,
      "false": 2
    },
    "p1": {
      "truth": 6,
      "false": 2
    },
    "p2": {
      "truth": 6,
      "false": 2
    }
  },
  "autoPaused": false,
  "winner": null,
  "endReason": null,
  "contentLang": "en",
  "phoneOnly": false
}
