{
  "phase": {
    "id": "bid",
    "startedAt": 1000,
    "deadline": null
  },
  "phaseClock": 1000,
  "rng": {
    "seed": 61822,
    "step": 16
  },
  "players": {
    "p0": {
      "id": "p0",
      "name": "Player 1",
      "avatarId": "face-0",
      "connected": true,
      "bot": true,
      "canSeeTv": true
    },
    "p1": {
      "id": "p1",
      "name": "Player 2",
      "avatarId": "face-1",
      "connected": true,
      "bot": true,
      "canSeeTv": true
    },
    "p2": {
      "id": "p2",
      "name": "Player 3",
      "avatarId": "face-2",
      "connected": true,
      "bot": true,
      "canSeeTv": true
    }
  },
  "order": [
    "p0",
    "p1",
    "p2"
  ],
  "settings": {
    "onesWild": true,
    "palificoEnabled": true,
    "palificoExemption": "none",
    "calzaEnabled": false,
    "calzaPolicy": "anyOther",
    "turnSeconds": 0
  },
  "cups": {
    "p0": [
      6,
      5,
      1,
      5,
      2
    ],
    "p1": [
      1,
      4,
      1,
      6,
      2
    ],
    "p2": [
      1,
      1,
      4,
      1,
      4
    ]
  },
  "diceCount": {
    "p0": 5,
    "p1": 5,
    "p2": 5
  },
  "turn": "p1",
  "round": 1,
  "bid": null,
  "bidLog": [],
  "palifico": false,
  "palificoStarter": null,
  "seenPalifico": {
    "p0": false,
    "p1": false,
    "p2": false
  },
  "nextStarter": "p1",
  "nextPalifico": null,
  "reveal": null,
  "eliminated": [],
  "left": [],
  "models": {
    "p0": {
      "truth": 3,
      "false": 2
    },
    "p1": {
      "truth": 3,
      "false": 2
    },
    "p2": {
      "truth": 3,
      "false": 2
    }
  },
  "autoPaused": false,
  "winner": null,
  "endReason": null,
  "contentLang": "en",
  "phoneOnly": false
}
